{
  "ecs_version": "1.0",
  "publication_id": "urn:example:publication:a",
  "artifact_id": "urn:example:artifact:a",
  "node_id": "urn:example:node:commons-1",
  "class": "research",
  "effective_at": "2026-10-12T16:01:00Z",
  "prior_publication_ref": null,
  "access_policy_ref": "urn:example:policy:research",
  "reason": null
}
